<?xml version="1.0" encoding="UTF-8"?>
<frequencyDoc xmlns:xsi="http://www.w3.org/2001/XMLSchema-instance"
    xsi:noNamespaceSchemaLocation="../xsd/frequency.xsd">
    <frequency type="class" name="Member">10</frequency>
    <frequency type="class" name="Loan">10</frequency>
    <frequency type="class" name="Return">1</frequency>
    <frequency type="class" name="Book">1</frequency>
    <frequency type="class" name="Publisher">1</frequency>
    <frequency type="class" name="Author">1</frequency>
    <frequency type="relation" name="loaned">10</frequency>
    <frequency type="relation" name="records">10</frequency>
    <frequency type="relation" name="commits">10</frequency>
    <frequency type="relation" name="writes">1</frequency>
    <frequency type="relation" name="supplies">1</frequency>
    <frequency type="query" name="Q1">10</frequency>
    <frequency type="query" name="Q2">60</frequency>
    <frequency type="query" name="Q3">20</frequency>
    <frequency type="query" name="Q4">60</frequency>
    <frequency type="query" name="Q5">20</frequency>
</frequencyDoc>